{"contract_version":"workbench-plugin-equivalence/v1","receipt_id":"workbench-0.2.0-replaces-workbench-ffb426f1","replacement_plugin":{"plugin_name":"workbench","plugin_version":"0.2.0","source_revision":"6d1c9786219eb1541a8272b8e92e44c7f2d76d08","plugin_manifest_digest":"sha256:7b3d76e9a414202312cbf9576162b298e85497fe012be760c519d0e0a6cb6121","source_ref":"https://github.com/YOOGOMJA/workbench-kit/tree/6d1c9786219eb1541a8272b8e92e44c7f2d76d08/plugins/workbench"},"public_contract":{"contract_version":"workbench-contract/v1","engine_name":"workbench","engine_version":"0.2.0","supported_object_digest":"sha256:c839e05a7106e34eb9d66cdb412cf922d659a9314b5b7afae99fd5f5cf0ca351","capabilities":["engine.manifest/v1","knowledge.applicability/v1","policy.applied-effect-recovery/v1","policy.authority/v1","policy.authorization/v1","policy.context-set/v1","policy.intent/v1","policy.resolve/v1","profile.language/v1","task.abandonment/v1","task.acceptance/v1","task.cleanup/v1","task.completion/v1","task.contract/v2","task.deliverables/v1","task.evidence/v1","task.harvest/v1","task.legacy-writer-projection/v1","task.lifecycle/v2","task.refs/v1","task.required-checks/v1","task.start/v2","task.writer-claims/v1","task.writer-conflicts/v1","task.writer-handoff/v1","task.writer-reconciliation/v1","task.writer-recovery/v1","workspace.authority/v1","workspace.doctor/v1","workspace.legacy-inventory-bootstrap/v1","workspace.legacy-inventory/v1","workspace.schema/v1"]},"required_capabilities":["engine.manifest/v1","knowledge.applicability/v1","policy.applied-effect-recovery/v1","policy.authority/v1","policy.authorization/v1","policy.context-set/v1","policy.intent/v1","policy.resolve/v1","profile.language/v1","task.abandonment/v1","task.acceptance/v1","task.cleanup/v1","task.completion/v1","task.contract/v2","task.deliverables/v1","task.evidence/v1","task.harvest/v1","task.legacy-writer-projection/v1","task.lifecycle/v2","task.refs/v1","task.required-checks/v1","task.start/v2","task.writer-claims/v1","task.writer-conflicts/v1","task.writer-handoff/v1","task.writer-reconciliation/v1","task.writer-recovery/v1","workspace.authority/v1","workspace.doctor/v1","workspace.legacy-inventory-bootstrap/v1","workspace.legacy-inventory/v1","workspace.schema/v1"],"legacy_source":{"source_ref":"https://github.com/YOOGOMJA/workbench","source_revision":"ffb426f1c316485c56950e599b7560d155fd220c"},"legacy_manifest_digest":"sha256:2094245f2e2715a99420557c2ae5826043968da922d0a7632dc08e7e127216a3","allowed_roots":[".agents/skills",".claude/skills","skills","utils"],"removable_nodes":[{"path":".agents/skills","node_type":"symlink","mode":"120000","digest":"sha256:17bac354766f22d980358a151e846bc73977eff7c112aeaf169ec60a0951f9db","link_target":"../skills"},{"path":".claude/skills","node_type":"symlink","mode":"120000","digest":"sha256:17bac354766f22d980358a151e846bc73977eff7c112aeaf169ec60a0951f9db","link_target":"../skills"},{"path":"skills/audit-codex-support/SKILL.md","node_type":"file","mode":"100644","digest":"sha256:62457e06a4d64972edc260cd0f38eac385acfd4fce09f99b4d64045829511527","link_target":null},{"path":"skills/caveman/README.md","node_type":"file","mode":"100644","digest":"sha256:37f4d89164f62af4ceadc7bf8bb6f79023211545cc4f21a9f92937dc08c1b467","link_target":null},{"path":"skills/caveman/SKILL.md","node_type":"file","mode":"100644","digest":"sha256:417bf0de723f87369c4bb736d29dabfeb581801b3e3510999a13d8683a1a5be4","link_target":null},{"path":"skills/codebase-onboard/SKILL.md","node_type":"file","mode":"100644","digest":"sha256:58b5a9da2638f6ad0c38159733f4a3bbb7450467c6aa01429945b70c1e2f8110","link_target":null},{"path":"skills/docs-ingest/SKILL.md","node_type":"file","mode":"100644","digest":"sha256:68d1e938d068e695aa54ba62dfdfb4df9549f1981de9ca2799b5984247d718b0","link_target":null},{"path":"skills/docs-lint/SKILL.md","node_type":"file","mode":"100644","digest":"sha256:e6387a6d95ac1b3994903b77a5c609fcdb38c3735c032e202ad23ce2b2caf519","link_target":null},{"path":"skills/docs-query/SKILL.md","node_type":"file","mode":"100644","digest":"sha256:50623d3a0745a85bd04e81d5ff45c446de18c87fa71073f9d3bb8fbb575d7e21","link_target":null},{"path":"skills/skill-harvest-recommender/SKILL.md","node_type":"file","mode":"100644","digest":"sha256:fe69936b2c20c234ccc42f60a10f3aef3d20a3c403fb76447a9bd662153103cb","link_target":null},{"path":"skills/task-done/SKILL.md","node_type":"file","mode":"100644","digest":"sha256:f21aef3cd6cb99e9224577dcc107abded1db4aa37d87ba5e82685f793275894a","link_target":null},{"path":"skills/task-start/SKILL.md","node_type":"file","mode":"100644","digest":"sha256:90c05ed92c7c3894c44b63cebc8b867d637483f67256b448a2da340ac3b51d8b","link_target":null},{"path":"skills/task-status/SKILL.md","node_type":"file","mode":"100644","digest":"sha256:29152557773b798b21133bb609c4399a72a5d7a556c89c426b633936018e30a3","link_target":null},{"path":"skills/task-submit/SKILL.md","node_type":"file","mode":"100644","digest":"sha256:37e17b5e5b9dd93255110fcfa783e4ed18603808e50465b2d1208f496f21e6fd","link_target":null},{"path":"skills/task-tickets/SKILL.md","node_type":"file","mode":"100644","digest":"sha256:b7bf6dbca8e5fe4e7a72e3996b475d4cfea727ac3a9e18c9566cebda46c1d89e","link_target":null},{"path":"skills/ticket-incubate/SKILL.md","node_type":"file","mode":"100644","digest":"sha256:94c3b5f71d985c14fadecc49536114a5e51a71deab08dfec87505347b207fabf","link_target":null},{"path":"utils/docs","node_type":"file","mode":"100755","digest":"sha256:39388c2b591420fdcfd7d43b7c1b15e03af6b5716bbd6b5fe50a306146487c1e","link_target":null},{"path":"utils/task","node_type":"file","mode":"100755","digest":"sha256:5ca61a7b46ecf69dc77906d03bdf36e587a030239c47d4e66ddf09e4809d03e1","link_target":null},{"path":"utils/workbench","node_type":"file","mode":"100755","digest":"sha256:640bf7e9f1c9430ebb418f0d0b3b73ce6330a4a715bf7f61ceead91f3cf5f74c","link_target":null}],"discovery_links":[{"path":".agents/skills","node_type":"symlink","mode":"120000","digest":"sha256:17bac354766f22d980358a151e846bc73977eff7c112aeaf169ec60a0951f9db","link_target":"../skills"},{"path":".claude/skills","node_type":"symlink","mode":"120000","digest":"sha256:17bac354766f22d980358a151e846bc73977eff7c112aeaf169ec60a0951f9db","link_target":"../skills"}],"verification_evidence":[{"evidence_id":"workbench-public-contract","kind":"contract-test","source_ref":"https://github.com/YOOGOMJA/workbench-kit/blob/6d1c9786219eb1541a8272b8e92e44c7f2d76d08/plugins/workbench/tests/contract.sh","source_revision":"6d1c9786219eb1541a8272b8e92e44c7f2d76d08","digest":"sha256:c5748f1d26f10d3e1d803cd527b1385da087baed93c639a3bf2d8dace171e787"},{"evidence_id":"three-plugin-public-e2e","kind":"integration-test","source_ref":"https://github.com/YOOGOMJA/workbench-kit/blob/6d1c9786219eb1541a8272b8e92e44c7f2d76d08/tests/cross_plugin_e2e.py","source_revision":"6d1c9786219eb1541a8272b8e92e44c7f2d76d08","digest":"sha256:7a4ff291977bf2969cbe1360e0ecbb7659528a10bcb1a381f2a514ad6f82a951"},{"evidence_id":"workbench-ffb426f1-engine-archive","kind":"manifest-audit","source_ref":"https://github.com/YOOGOMJA/workbench-kit/blob/6d1c9786219eb1541a8272b8e92e44c7f2d76d08/tests/fixtures/legacy/workbench-ffb426f1-engine.tar.gz.b64","source_revision":"6d1c9786219eb1541a8272b8e92e44c7f2d76d08","digest":"sha256:96cabb1775cfd217b1cdb11d22c86c2e7fa61dc9b164db24a5597ff8565ba68d"}]}
